cluster_id,size,date_range,avg_word_count,keywords,top_authors
0,27,2011-10-06 to 2013-07-26,895.0,"Stocks Advance, Apple Rally Fades, Asia Stocks Rise First Day, Five, European","Shani RajaYoshiaki Nohara, Michael P.ReganRita Nazareth, Chan Tien HinJason Webb, Yoshiaki Nohara, Kyunghee Park"
1,18,2012-09-19 to 2013-07-26,822.8333333333334,"End, Windows, Microsoft, Ballmer Says Company Must Combine Hardware, Software","Aaron Ricadela, Cliff Edwards, Dina Bass, Aoife White, Ryan FaughnderDouglas Mac Millan"
2,13,2011-10-01 to 2013-07-27,1048.3846153846155,"Apple General Counsel Sewell Becomes Protector, Jobs, Vision Samsung, Oracle, Style Empire","Victoria Slind-Flor, Susan Decker, Jun YangKarin Matussek, Thomas MulierAmy Thomson, Bloomberg News"
3,16,2011-10-07 to 2013-07-26,616.5625,"Samsung Profit Beats Estimates, Galaxy Smartphones Challenge Apple, High, End Smartphone Boom Ending, Price Drop Hits Apple","Jun Yang, Hugo Miller, Adam Ewing, Bloomberg News, Peter Burrows"
4,6,2011-10-06 to 2012-09-27,299.1666666666667,"Foxconn, Woo Comments, Passing, Apple, Steve Jobs China Mobile","Tim Culpan, Mark Lee, Jun YangSaeromi Shin, Bloomberg News"
5,22,2011-10-06 to 2013-07-19,542.4545454545455,"Steve Jobs, Death, Fans Hold, Lit Vigils, Steve Jobs Jobs Waged Eight","Dina BassDouglas Mac MillanDanielle Kucera, John Lauerman, Karen Gullo, AnKrishnamoorthySusan Li, Rosabeth Moss Kanter"
