cluster_id,size,date_range,avg_word_count,keywords,top_authors
0,30,2011-10-06 to 2011-10-06,66.76666666666667,"Group Dividend, Yen, Dividend, Group Net Income Estimate, Yen Tact Home Co Ltd",
1,33,2012-09-21 to 2013-07-26,77.81818181818181,"Deals, India Money Markets, Bank, Deposits Reported, Indian Money Market","Shraddha Kothari, Pooja Saraf"
2,32,2011-10-01 to 2013-07-21,324.5625,"World, Lead, Rugby, Rugby World Cup Victory Would Elevate All Blacks Brand Past, Million Read","Dan Baynes, Bob Bensch, Peter-Joseph Hegarty, Christopher Elser, Alena Chechel"
3,50,2011-10-01 to 2013-07-26,339.28,"Sun Says, David Beckham, Endorsement Income Rises, Galaxy Contract Approaches End, Whistleblower Chuck Blazer","Bob Bensch, Dan Baynes, Christopher Elser, Alex Duff, Peter-Joseph Hegarty"
4,49,2011-10-01 to 2013-07-27,436.0612244897959,"East Lead, Return, Major League Baseball, Postseason Schedule, Results Cardinals Beat Phillies","Rob Gloster, Nancy Kercheval, Erik Matuszewski, Mason Levinson, Eben Novy-Williams"
5,46,2011-10-06 to 2013-07-26,553.4782608695652,"Australian Homes, Sale Jump, September, Says New Zealand Dollar Falls Against, Currency","Cice Zachariahs, Nichola Saminather, Kristine Aquino, Michael Heath, James Paton"
6,33,2011-10-01 to 2013-07-26,299.24242424242425,"Harvin, America, Called Seahawks, Drops Hank Williams Jr, Song From Monday Football","Erik Matuszewski, Eben Novy-Williams, Aaron Kuriloff, Mason Levinson, Curtis Eichelberger"
7,46,2011-10-01 to 2013-07-26,360.4347826086956,"Join Big, Longest, Win Streak, Knicks Get, Straight","Erik Matuszewski, Eben Novy-Williams, Nancy Kercheval, Curtis Eichelberger, Dex Mc Luskey"
8,47,2011-10-01 to 2013-08-16,548.1489361702128,"Text, Almost, Canada August Building Permits, Statistical Summary Canada September Home Sales May Have Fallen, Data Show Canada September","Ilan Kolet, Greg Quinn, Theophilos Argitis, Eric Lam, Andrew Mayeda"
9,43,2011-10-01 to 2013-04-01,171.27906976744185,"September, Fifth Month, Day Rise, Four Months, Summary Bolivia September Consumer Price Index","John Quigley, Dominic Carey, Mark Evans, Ainhoa Goyeneche, Harumi Ichikura"
10,73,2011-10-01 to 2013-07-29,399.05479452054794,"Moody, Week Low, Mexican Senate Asks Pemex, Testify, Repsol","Ben Bain, Sebastian Boyd, Andrea Jaramillo, Rall Woods, Eliana Raszewski"
11,85,2011-10-01 to 2013-07-26,406.9764705882353,"Million, Profit Beats Forecasts, Hour, Year Low, Moderate Brazil Rate Cuts Fit","Julia Leite, Denyse Godoy, Dominic Carey, Raymond Colitt, Blake SchmidtJosue Leonel"
12,170,2011-10-01 to 2013-07-26,362.0529411764706,"Oct, Tons, Signs, Jump, Sugar","Rudy Ruitenberg, Marina Sysoyeva, Isis Almeida, Elizabeth Campbell, Tony C.Dreibus"
13,31,2011-10-06 to 2013-07-26,328.80645161290323,"Third Day, Two, Kharisma Sells, Tons, Thailand Stocks","Ranjeetha Pakiam, Aya Takada, Bloomberg News, Supunnabul Suwannakij, Anuchit Nguyen"
14,52,2011-10-06 to 2013-07-26,594.7692307692307,"Week, Spain Aid Report, Rupee Jumps, Pakistan May Cut Rates, Spur Growth Weakened","Jeanette Rodrigues, Rajhkumar KShaaw, V.Ramakrishnan, Ian SaysonSridhar Natarajan, Unni Krishnan"
15,78,2011-10-01 to 2013-07-27,678.0128205128206,"Christie, Weekend, Sale, Red Coats Bawled, Got Drunk","Guy Collins, Richard Vines, Farah Nayeri, Greg EvansCraig Seligman, Mark Beech"
16,36,2011-10-06 to 2013-07-26,399.27777777777777,"Iron, China, Cut Copper Output, Steel Scrap Exports, Country","Bloomberg News, Joe Richter, Stephen Rose, Agnieszka Troszkiewicz, Joe RichterAgnieszka Troszkiewicz"
17,43,2011-10-06 to 2013-07-26,344.90697674418607,"Oct, Premium, Percent, Gold, Holdings Unchanged","Stephen Rose, Debarati Roy, Glenys Sim, Daniel Petrie, Nicholas LarkinDebarati Roy"
18,33,2011-10-06 to 2013-07-26,388.1818181818182,"Billion Baht, Thai Flood Death Toll Rises, Waters Threaten Honda, Sony Thailand, Central Pattana Said","Yumi Teso, Yudith Ho, Suttinee Yuvejwattana, Supunnabul Suwannakij, Daniel Ten KateSuttinee Yuvejwattana"
19,82,2011-10-01 to 2013-07-26,529.6951219512196,"Month High, Court, Credit, Month Low, High","Andrea Wong, Saeromi Shin, Bloomberg News, Jiyeun Lee, Pooja Thakur"
20,43,2011-10-01 to 2013-07-26,409.5581395348837,"Euros, Million Carbon Permits, Proposes, Plunge May Create Funding Gap, Carbon Capture","Alessro Vitelli, Mathew Carr, Ewa Krukowska, Marek Strzelecki, Catherine Airlie"
21,46,2011-10-01 to 2013-07-26,383.67391304347825,"Percent, Clean, Tech Companies Should Get, Year Tax Breaks, Hundt Says Energy Dept","Chisaki Watanabe, Ehren Goossens, Justin Doom, Natalie Obiko Pearson, Bloomberg News"
22,34,2011-10-06 to 2013-07-26,308.8529411764706,"Highest, Vestas Wind Systems Gets, Megawatt Turbine Order, Sweden Norway Heads, Record Electricity Exports Amid Water Glut Nordic Power Price Declines","Torsten Fagerholm, Sally Bakewell, Marek Strzelecki, Alex Morales, Stefan Nicola"
23,43,2011-10-01 to 2013-07-26,352.93023255813955,"Billion, Million, La Paz, Afghanistan Gets Preliminary Agreement, Loan South Africa Daybook","Robert Br, Srine Rastello, Robert BrStephen Gunnion, Nadine Marroushi, Carli Cooke"
24,106,2008-03-17 to 2013-07-27,612.2264150943396,"Million, Wins, Backing, Said, Patients","Anna Edney, Meg Tirrell, Alex Wayne, Alex Nussbaum, Michelle Fay Cortez"
25,104,2011-10-01 to 2013-07-27,544.3269230769231,"Syrian Rebels, Egypt, Doctor Accused, Aiding Bin Laden Raid May Face Treason Charge, Chief Rasmussen Says","Selcan Hacaoglu, Flavia Krause-Jackson, Donna Abu-Nasr, Khurrum Anis, Calev Ben-David"
26,100,2010-01-26 to 2013-07-26,618.68,"Japan Credit Japan, Five, Month High, Jobs, Advances","Yoshiaki Nohara, Norie Kuboyama, Adam Haigh, Minh Bui, Jonathan Burgos"
27,112,2007-09-07 to 2013-07-26,613.7321428571429,"China, Year High, Fixing, Million, Developers","Bloomberg News, Kyoungwha Kim, Belinda Cao, Billy Chan, Kana Nishizawa"
28,52,2011-10-06 to 2013-07-26,315.34615384615387,"Months, Lagos Mover, Month, Weeks, Day","Sarah Mc Gregor, Eric Ombok, Vincent Nwanma, Emele Onu, Moses Mozart Dzawu"
29,91,2011-10-01 to 2013-07-26,449.4945054945055,"German Two, First Time, Spain, Yield, German","Andrew Frye, David Goodman, Angeline Benoit, Joao Lima, Paul Dobson"
30,385,2007-12-14 to 2013-07-26,374.3766233766234,"Billion, Greece, Says, Month Low, Million","Andras Gergely, Jasmina Kuzmanovic, Gordana Filipovic, James G.Neuger, Brian Parkin"
31,86,2010-06-15 to 2013-07-26,452.48837209302326,"Second Day, Bank, Copenhagen Mover, Fourth, Year High","Adria Cimino, Jonathan Morgan, Krystof Chamonikolas, Christian Wienberg, Tom Stoukas"
32,70,2011-10-01 to 2013-07-26,457.62857142857143,"Bank, Rate Decision, Purchase Program, England Inflation Report, Households Jumps","Jennifer Ryan, Scott Hamilton, Lucy Meakin, Robert Hutton, Barbara Sladkowska"
33,31,2011-10-01 to 2013-07-21,260.93548387096774,"World, Billion, Dubai Stocks Gain, End, Day Drop","Deema Almashabi, Mourad Haroutunian, Alaa Shahine, Zahra Hankir, Shaji Mathew"
34,59,2011-10-01 to 2013-07-28,581.3898305084746,"Airbus German Workers Plan Work Stoppage, Contract Dispute Porsche Takes Charges From, Purchases, Handelsblatt Says Saab Says Companies, Showing Interest","Craig Trudell, Mathieu Rosemain, Bloomberg News, Dawn Mc CartyBill Rochelle, Tim HigginsCraig Trudell"
35,36,2010-01-22 to 2013-07-26,802.0,"Text, February, Most, September Small Business Jobs Summary Bloomberg Weekly Consumer Comfort Index, Oct","Shobhana Chra, Alex Tanzi, Chris Middleton, Lorraine Woellert, Kristy Scheuble"
36,32,2011-10-06 to 2013-07-27,661.84375,"Southwest Sees, Billion Atlanta Revenue Gain, Merger Alere Agrees With Axis, Shield, Board","Robert Wall, Mary Schlangenstein, Tony Capaccio, Robert WallAndrea Rothman, Mary Jane Credeur"
37,53,2011-10-06 to 2013-07-26,454.1132075471698,"Month Low, Weekly Petroleum Status Report, Text, Commodities, Four","Naureen S.Malik, Lynn Doan, Barbara Powell, Paul Burkhardt, Christine Harvey"
38,108,2011-10-06 to 2013-07-26,474.287037037037,"Commodities, Oil Market News, Japan, New York, Day Gain","Grant Smith, Christian Schmollinger, Mark Shenk, Moming Zhou, Rupert Rowling"
39,46,2011-10-06 to 2013-07-26,493.39130434782606,"Aug, Home Price Index, September, August, State","Alex Tanzi, Prashant Gopal, Michelle Jamrisko, Chris Spillane, Kristy Scheuble"
40,47,2011-10-06 to 2013-07-26,559.2340425531914,"Decade, Gas, Oil, Sands, Match Conventional","Zulfugar Agayev, Mark Drajem, Eduard Gismatullin, Mikael Holter, Freeman Klopott"
41,80,2007-09-07 to 2013-07-26,379.1875,"Billion, Lukoil, Second Day, Dollar, Months","Yuliya Fedorinova, Scott Rose, Ksenia Galouchko, Lyubov Pronina, Henry Meyer"
42,57,2011-10-01 to 2013-07-26,553.2631578947369,"China, Dishonor, Italy Reports Seven New Cases, Anthrax, Widening Outbreak Russia Says","Bloomberg News, Gopal Ratnam, Isabel ReynoldsTakashi Hirokawa, Tsuyoshi Inajima, William Pesek"
43,32,2011-10-06 to 2013-07-26,535.46875,"Mart, Wal, Million, Greggs Rises After Saying Third, Quarter Sales Increased","Matt Townsend, Janice Kew, James Callan, Chelsey Dulaney, Namitha Jagadeesh"
44,36,2011-10-06 to 2013-07-26,659.25,"Oct, Stocks Fall, Surprises, Companies, Stocks Rise","Stephen Rose, Wendy Soong, Alex BarinkaNikolaj Gammeltoft, Lu Wang, Michael P.Regan"
45,118,2010-01-26 to 2013-07-27,587.9067796610169,"Death, Apple, Steve Jobs, China, Jobs","Aaron Ricadela, Victoria Slind-Flor, Bloomberg News, Tim Culpan, Hugo Miller"
46,61,2011-10-06 to 2013-07-26,540.0819672131148,"Billion, Mobile, Bid, Canal Plus Are Close, Agreement","Ilya Khrennikov, Crayton Harrison, Cornelius Rahn, Manuel Baigorri, Amy Thomson"
47,44,2011-10-01 to 2013-07-26,545.9545454545455,"Close, Reaches Agreement With Time Warner, Network, March, New York","Andy Fixmer, Cliff Edwards, Todd Shields, Scott Soshnick, Michael White"
48,154,2011-10-01 to 2013-07-27,762.0974025974026,"Obama, Million, Vote, End, Fiscal Cliff","Terrence Dopp, Elise Young, Ramesh Ponnuru, Josh Barro, the Editors"
49,78,2011-10-01 to 2013-07-26,472.64102564102564,"Billion, Million, Said, Business, Dixon","Hui-yong Yu, Joe Carroll, Sabrina Willmer, Tim Smith, Peter Woodifield"
50,31,2011-10-06 to 2013-07-26,520.741935483871,"Million, Failed, Sold, Seeks, Baum","Chris Dolmetsch, Joe Schneider, Steven Church, Dawn Mc Carty, Linda Sler"
51,72,2011-10-06 to 2013-07-27,870.8611111111111,"Says, Says Ex, Cohen, Months, Bird","Patricia Hurtado, Bob Van Voris, Lindsay Fortado, Edvard Pettersson, Joshua Gallu"
52,33,2011-10-06 to 2013-07-26,492.969696969697,"Jobs, Pay, Says, Said, Oman International","Howard Mustoe, Michael J.Moore, Donal Griffin, Arif Sharif, Kaitlyn Kiernan"
53,101,2011-10-01 to 2013-07-26,598.3564356435644,"Billion, Open, Day, Says, Treasuries","Liz Capo Mc Cormick, Susanne Walker, Steve Matthews, Sarika Gangar, Michelle Kaske"
54,56,2010-01-26 to 2013-07-27,734.4642857142857,"Banks, Big, Million, Dodd, Frank","Silla Brush, Carla Main, Carter Dougherty, Cheyenne Hopkins, Jesse Hamilton"
